[
  {
    "variant": "web_gtm",
    "iteration": 1,
    "rid": "web_gtm-1-1f4857f8",
    "wall_ms": 4681.724035999991,
    "dcl": 237.59999999997672,
    "load": 2233.6999999999534,
    "responseEnd": 173.19999999995343,
    "lcp": 2244,
    "cls": 0,
    "longTaskCount": 4,
    "longTaskDuration": 483,
    "tbt": 283,
    "interactionDelay": 8.400000000023283,
    "errors": [],
    "resourceEntries": [
      {
        "name": "http://127.0.0.1:8765/assets/web-container.js?rid=web_gtm-1-1f4857f8&mode=direct",
        "transferSize": 12691,
        "encodedBodySize": 12391,
        "duration": 277.79999999993015,
        "initiatorType": "script"
      },
      {
        "name": "http://127.0.0.1:8765/assets/hero.jpg?rid=web_gtm-1-1f4857f8",
        "transferSize": 226350,
        "encodedBodySize": 226050,
        "duration": 2038.4000000000233,
        "initiatorType": "img"
      },
      {
        "name": "http://127.0.0.1:8765/assets/vendor.js?rid=web_gtm-1-1f4857f8&mode=direct&vendor=1",
        "transferSize": 32843,
        "encodedBodySize": 32543,
        "duration": 947,
        "initiatorType": "script"
      },
      {
        "name": "http://127.0.0.1:8765/assets/vendor.js?rid=web_gtm-1-1f4857f8&mode=direct&vendor=2",
        "transferSize": 32843,
        "encodedBodySize": 32543,
        "duration": 954.4000000000233,
        "initiatorType": "script"
      },
      {
        "name": "http://127.0.0.1:8765/assets/vendor.js?rid=web_gtm-1-1f4857f8&mode=direct&vendor=3",
        "transferSize": 32843,
        "encodedBodySize": 32543,
        "duration": 961.5999999999767,
        "initiatorType": "script"
      },
      {
        "name": "http://127.0.0.1:8765/assets/vendor.js?rid=web_gtm-1-1f4857f8&mode=direct&vendor=4",
        "transferSize": 32843,
        "encodedBodySize": 32543,
        "duration": 975.9000000000233,
        "initiatorType": "script"
      },
      {
        "name": "http://127.0.0.1:8765/third-party/collect?rid=web_gtm-1-1f4857f8&vendor=1",
        "transferSize": 300,
        "encodedBodySize": 0,
        "duration": 182,
        "initiatorType": "beacon"
      },
      {
        "name": "http://127.0.0.1:8765/third-party/collect?rid=web_gtm-1-1f4857f8&vendor=2",
        "transferSize": 300,
        "encodedBodySize": 0,
        "duration": 179.90000000002328,
        "initiatorType": "beacon"
      },
      {
        "name": "http://127.0.0.1:8765/third-party/collect?rid=web_gtm-1-1f4857f8&vendor=3",
        "transferSize": 300,
        "encodedBodySize": 0,
        "duration": 174.19999999995343,
        "initiatorType": "beacon"
      },
      {
        "name": "http://127.0.0.1:8765/third-party/collect?rid=web_gtm-1-1f4857f8&vendor=4",
        "transferSize": 300,
        "encodedBodySize": 0,
        "duration": 180.30000000004657,
        "initiatorType": "beacon"
      },
      {
        "name": "http://127.0.0.1:8765/favicon.ico",
        "transferSize": 314,
        "encodedBodySize": 14,
        "duration": 157.40000000002328,
        "initiatorType": "other"
      }
    ],
    "request_count": 12,
    "failed_request_count": 0,
    "transfer_bytes": 374707,
    "js_request_count": 5,
    "js_transfer_bytes": 143648,
    "browser_event_request_count_cdp": 4,
    "server_browser_event_requests": 4,
    "logical_destination_deliveries": 4,
    "server_event_paths": [
      "/third-party/collect",
      "/third-party/collect",
      "/third-party/collect",
      "/third-party/collect"
    ]
  },
  {
    "variant": "sgtm_consolidated",
    "iteration": 1,
    "rid": "sgtm_consolidated-1-2f199155",
    "wall_ms": 4023.4923900000013,
    "dcl": 202.59999999997672,
    "load": 1561.2999999999302,
    "responseEnd": 170.09999999997672,
    "lcp": 1576,
    "cls": 0,
    "longTaskCount": 0,
    "longTaskDuration": 0,
    "tbt": 0,
    "interactionDelay": 7,
    "errors": [],
    "resourceEntries": [
      {
        "name": "http://127.0.0.1:8765/assets/dispatcher.js?rid=sgtm_consolidated-1-2f199155",
        "transferSize": 16852,
        "encodedBodySize": 16552,
        "duration": 320,
        "initiatorType": "script"
      },
      {
        "name": "http://127.0.0.1:8765/assets/hero.jpg?rid=sgtm_consolidated-1-2f199155",
        "transferSize": 226350,
        "encodedBodySize": 226050,
        "duration": 1375.0999999999767,
        "initiatorType": "img"
      },
      {
        "name": "http://127.0.0.1:8765/collect/sgtm?rid=sgtm_consolidated-1-2f199155",
        "transferSize": 300,
        "encodedBodySize": 0,
        "duration": 168.90000000002328,
        "initiatorType": "beacon"
      }
    ],
    "request_count": 4,
    "failed_request_count": 0,
    "transfer_bytes": 247280,
    "js_request_count": 1,
    "js_transfer_bytes": 16769,
    "browser_event_request_count_cdp": 1,
    "server_browser_event_requests": 1,
    "logical_destination_deliveries": 4,
    "server_event_paths": [
      "/collect/sgtm"
    ]
  },
  {
    "variant": "control",
    "iteration": 1,
    "rid": "control-1-1f26f821",
    "wall_ms": 3927.392906000023,
    "dcl": 204.69999999995343,
    "load": 1472.1999999999534,
    "responseEnd": 169.40000000002328,
    "lcp": 1484,
    "cls": 0,
    "longTaskCount": 0,
    "longTaskDuration": 0,
    "tbt": 0,
    "interactionDelay": 8.600000000093132,
    "errors": [],
    "resourceEntries": [
      {
        "name": "http://127.0.0.1:8765/assets/hero.jpg?rid=control-1-1f26f821",
        "transferSize": 226350,
        "encodedBodySize": 226050,
        "duration": 1284.4000000000233,
        "initiatorType": "img"
      }
    ],
    "request_count": 2,
    "failed_request_count": 0,
    "transfer_bytes": 230292,
    "js_request_count": 0,
    "js_transfer_bytes": 0,
    "browser_event_request_count_cdp": 0,
    "server_browser_event_requests": 0,
    "logical_destination_deliveries": 0,
    "server_event_paths": []
  },
  {
    "variant": "sgtm_proxy_only",
    "iteration": 1,
    "rid": "sgtm_proxy_only-1-f21bb2ac",
    "wall_ms": 4661.613049000039,
    "dcl": 188.09999999997672,
    "load": 2230.0999999999767,
    "responseEnd": 170.40000000002328,
    "lcp": 2248,
    "cls": 0,
    "longTaskCount": 4,
    "longTaskDuration": 459,
    "tbt": 259,
    "interactionDelay": 9.199999999953434,
    "errors": [],
    "resourceEntries": [
      {
        "name": "http://127.0.0.1:8765/assets/web-container.js?rid=sgtm_proxy_only-1-f21bb2ac&mode=proxy",
        "transferSize": 12698,
        "encodedBodySize": 12398,
        "duration": 279.4000000000233,
        "initiatorType": "script"
      },
      {
        "name": "http://127.0.0.1:8765/assets/hero.jpg?rid=sgtm_proxy_only-1-f21bb2ac",
        "transferSize": 226350,
        "encodedBodySize": 226050,
        "duration": 2041.0999999999767,
        "initiatorType": "img"
      },
      {
        "name": "http://127.0.0.1:8765/assets/vendor.js?rid=sgtm_proxy_only-1-f21bb2ac&mode=proxy&vendor=1",
        "transferSize": 32855,
        "encodedBodySize": 32555,
        "duration": 952.9000000000233,
        "initiatorType": "script"
      },
      {
        "name": "http://127.0.0.1:8765/assets/vendor.js?rid=sgtm_proxy_only-1-f21bb2ac&mode=proxy&vendor=2",
        "transferSize": 32855,
        "encodedBodySize": 32555,
        "duration": 960.0999999999767,
        "initiatorType": "script"
      },
      {
        "name": "http://127.0.0.1:8765/assets/vendor.js?rid=sgtm_proxy_only-1-f21bb2ac&mode=proxy&vendor=3",
        "transferSize": 32855,
        "encodedBodySize": 32555,
        "duration": 966.5,
        "initiatorType": "script"
      },
      {
        "name": "http://127.0.0.1:8765/assets/vendor.js?rid=sgtm_proxy_only-1-f21bb2ac&mode=proxy&vendor=4",
        "transferSize": 32855,
        "encodedBodySize": 32555,
        "duration": 973.6999999999534,
        "initiatorType": "script"
      },
      {
        "name": "http://127.0.0.1:8765/collect/proxy?rid=sgtm_proxy_only-1-f21bb2ac&vendor=1",
        "transferSize": 300,
        "encodedBodySize": 0,
        "duration": 175.5,
        "initiatorType": "beacon"
      },
      {
        "name": "http://127.0.0.1:8765/collect/proxy?rid=sgtm_proxy_only-1-f21bb2ac&vendor=2",
        "transferSize": 300,
        "encodedBodySize": 0,
        "duration": 181.30000000004657,
        "initiatorType": "beacon"
      },
      {
        "name": "http://127.0.0.1:8765/collect/proxy?rid=sgtm_proxy_only-1-f21bb2ac&vendor=3",
        "transferSize": 300,
        "encodedBodySize": 0,
        "duration": 179.5,
        "initiatorType": "beacon"
      },
      {
        "name": "http://127.0.0.1:8765/collect/proxy?rid=sgtm_proxy_only-1-f21bb2ac&vendor=4",
        "transferSize": 300,
        "encodedBodySize": 0,
        "duration": 175.19999999995343,
        "initiatorType": "beacon"
      }
    ],
    "request_count": 11,
    "failed_request_count": 0,
    "transfer_bytes": 374603,
    "js_request_count": 5,
    "js_transfer_bytes": 143703,
    "browser_event_request_count_cdp": 4,
    "server_browser_event_requests": 4,
    "logical_destination_deliveries": 4,
    "server_event_paths": [
      "/collect/proxy",
      "/collect/proxy",
      "/collect/proxy",
      "/collect/proxy"
    ]
  },
  {
    "variant": "web_gtm",
    "iteration": 2,
    "rid": "web_gtm-2-aa6317de",
    "wall_ms": 4643.980682999995,
    "dcl": 200.19999999995343,
    "load": 2218.5999999999767,
    "responseEnd": 169.19999999995343,
    "lcp": 2232,
    "cls": 0,
    "longTaskCount": 4,
    "longTaskDuration": 453,
    "tbt": 253,
    "interactionDelay": 10.699999999953434,
    "errors": [],
    "resourceEntries": [
      {
        "name": "http://127.0.0.1:8765/assets/web-container.js?rid=web_gtm-2-aa6317de&mode=direct",
        "transferSize": 12691,
        "encodedBodySize": 12391,
        "duration": 275.80000000004657,
        "initiatorType": "script"
      },
      {
        "name": "http://127.0.0.1:8765/assets/hero.jpg?rid=web_gtm-2-aa6317de",